{
  "schemaVersion": 1,
  "tier": "public",
  "updatedAt": "2026-01-15T12:00:00.000Z",
  "tags": [
    "sample",
    "creami"
  ],
  "photos": [],
  "provenance": {
    "source": "manual"
  },
  "id": "fixture-sample-creami-pint",
  "slug": "sample-creami-pint",
  "type": "recipe",
  "title": "Sample Creami pint",
  "date": "2026-01-20",
  "body": "Sample recipe intro.",
  "data": {
    "kind": "creami",
    "servings": 2,
    "proteinPerServing": 30,
    "ingredients": [
      {
        "item": "Ingredient one",
        "quantity": "200 g"
      },
      {
        "item": "Ingredient two",
        "quantity": "1 tbsp"
      },
      {
        "item": "Salt"
      }
    ],
    "steps": [
      "Prepare everything.",
      "Cook until done.",
      "Serve."
    ]
  }
}
