{
  "schemaVersion": 1,
  "tier": "public",
  "updatedAt": "2026-01-15T12:00:00.000Z",
  "tags": [
    "sample",
    "french"
  ],
  "photos": [],
  "provenance": {
    "source": "manual"
  },
  "id": "fixture-sample-bistro",
  "slug": "sample-bistro",
  "type": "place",
  "title": "Sample Bistro",
  "date": "2026-01-10",
  "rating": 3.5,
  "sourceRating": "3.5/5",
  "body": "Sample review text. Great place, would return.",
  "location": {
    "name": "Sample Bistro",
    "city": "San Francisco",
    "lat": 37.775,
    "lng": -122.418
  },
  "data": {
    "cuisine": "French",
    "priceLevel": 3,
    "visitDates": [
      "2026-01-10"
    ],
    "dishes": [
      "House special",
      "Seasonal side"
    ]
  }
}
