{
  "schemaVersion": 1,
  "tier": "public",
  "updatedAt": "2026-01-15T12:00:00.000Z",
  "tags": [
    "sample"
  ],
  "photos": [],
  "provenance": {
    "source": "manual"
  },
  "id": "fixture-sample-cheese-one",
  "slug": "sample-cheese-one",
  "type": "collection_entry",
  "title": "Sample Cheese One",
  "date": "2026-01-25",
  "rating": 4,
  "body": "Sample notes.",
  "data": {
    "collection": "cheeses",
    "status": "tried"
  }
}
