{
  "schemaVersion": 1,
  "tier": "public",
  "updatedAt": "2026-01-15T12:00:00.000Z",
  "tags": [
    "sample"
  ],
  "photos": [
    {
      "path": "/life-media/fixtures/photo-1.jpg",
      "width": 1200,
      "height": 800,
      "alt": "Placeholder image"
    }
  ],
  "provenance": {
    "source": "gpx"
  },
  "id": "fixture-sample-ridge-loop",
  "slug": "sample-ridge-loop",
  "type": "hike",
  "title": "Sample Ridge Loop",
  "date": "2026-02-14",
  "rating": 4,
  "body": "Sample trail report.",
  "location": {
    "name": "Sample Ridge Loop",
    "lat": 37.3,
    "lng": -122.2
  },
  "data": {
    "trailName": "Sample Ridge Loop",
    "distanceKm": 8.4,
    "elevationGainM": 420,
    "durationMin": 150
  }
}
